category,category_label,weight,input_metrics,score_calculation
defensive_protection,Defensive protection,0.3,"tackles_interceptions_per90, interceptions_per90, dribblers_tackled_pct, blocks_per90, aerial_duel_win_pct, def_mid_third_actions_per90",Average of available input-metric percentile scores
transition_control,Transition control,0.25,"ball_recoveries_per90, pressure_regains_per90, def_actions_after_loss_per90, fouls_committed_per90, cards_per90, miscontrols_per90, dispossessed_per90",Average of available input-metric percentile scores
possession_security,Possession security,0.25,"pass_completion_pct, short_medium_pass_completion_pct, passes_received_per90, touches_per90, dispossessed_per_touch, miscontrols_per_touch, turnover_rate",Average of available input-metric percentile scores
progressive_value,Progressive value,0.15,"progressive_passes_per90, progressive_carries_per90, passes_into_final_third_per90, carries_into_final_third_per90, progressive_passing_distance_per90, live_ball_sca_per90",Average of available input-metric percentile scores
age_availability,Age / availability,0.05,"age_score, minutes_score",Average of available input-metric percentile scores
